BB ETF IBOVESPA FUNDO DE ÍNDICE;BB ETF IBOV;;BBOV;
BB ETF S&P DIVIDENDOS BRASIL FUNDO DE ÍNDICE;BB ETF SP DV;;BBSD;
BTG PACTUAL ESG FUNDO DE ÍNDICE S&P/B3 BRAZIL ES;ETF ESG BTG;;ESGB;
CAIXA ETF IBOVESPA FUNDO DE INDICE;CAIXAETFXBOV;;XBOV;
ETF BRADESCO IBOVESPA FDO DE INDICE;ETF BRA IBOV;;BOVB;
ISHARES BMFBOVESPA SMALL CAP FUNDO DE ÍNDICE;ISHARES SMAL;;SMAL;
ISHARES IBOVESPA FUNDO DE ÍNDICE;ISHARES BOVA;;BOVA;
ISHARES IBRX - ÍNDICE BRASIL (IBRX-100) FDO ÍNDICE;ISHARES BRAX;;BRAX;
ISHARES ÍNDICE CARBONO EFIC. (ICO2) BRASIL-FDO ÍND;ISHARES ECOO;;ECOO;
ISHARES S&P 500 FDO INV COTAS FDO INDICE;ISHARE SP500;;IVVB;
IT NOW IBOVESPA FUNDO DE ÍNDICE;IT NOW IBOV;;BOVV;
IT NOW IDIV FUNDO DE ÍNDICE;IT NOW IDIV;;DIVO;
IT NOW IFNC FUNDO DE ÍNDICE;IT NOW IFNC;;FIND;
IT NOW IGCT FUNDO DE ÍNDICE;IT NOW IGCT;;GOVE;
IT NOW IMAT FUNDO DE ÍNDICE;IT NOW IMAT;;MATB;
IT NOW ISE FUNDO DE ÍNDICE;IT NOW ISE;;ISUS;
IT NOW PIBB IBRX-50 - FUNDO DE ÍNDICE;IT NOW PIBB;;PIBB;
IT NOW S&P500 TRN FUNDO DE INDICE;IT NOW SPXI;;SPXI;
IT NOW SMALL FDO ÍNDICE;IT NOW SMALL;;SMAC;
TREND ETF IFIX FUNDO DE ÍNDICE;TREND IFIX;;XFIX;
TREND ETF LBMA OURO FDO. INV. ÍNDICE - INVEST. EXT;TREND OURO;;GOLD;
TREND ETF MSCI ACWI FDO. INV. ÍNDICE - INVEST. EXT;TREND ACWI;;ACWI;
TREND ETF MSCI CHINA FDO. INV. ÍNDICE - INV. EXT.;TREND CHINA;;XINA;
TREND ETF MSCI EUROPA FDO. INV. ÍNDICE - INV. EXT.;TREND EUROPA;;EURP;
